{
  "id": "CPU-PAVIM-ATI-052-PROD-001",
  "codigo": "CPU-PAVIM-ATI-052-PROD-001",
  "descricao": "Produção CPU-PAVIM-ATI-052",
  "origem": "PROPRIA",
  "valor_horario": 300.0,
  "composicao_padrao_equipe": {
    "funcoes": [
      {
        "funcao_id": "MO-OPER-MOTO",
        "num_pessoas": 1
      },
      {
        "funcao_id": "MO-OPER-ROLO-COMP",
        "num_pessoas": 2
      },
      {
        "funcao_id": "MO-MOTOR-CAM-PIPA",
        "num_pessoas": 1
      },
      {
        "funcao_id": "MO-ENCARREG-CAPA",
        "num_pessoas": 1
      }
    ],
    "equipamentos": [
      {
        "equip_id": "EQ-E0028",
        "num_unidades": 1
      },
      {
        "equip_id": "EQ-E0036",
        "num_unidades": 1
      },
      {
        "equip_id": "EQ-E0010",
        "num_unidades": 1
      }
    ]
  },
  "atributos_categoria": {
    "custo_padrao_clt": 2.1183,
    "custo_padrao_pj": 1.8001
  },
  "cpu_ids": [
    "CPU-PAVIM-ATI-052"
  ]
}