{
  "id": "CPU-DREN-REATERRO-COMPAC-PROD-001",
  "codigo": "CPU-DREN-REATERRO-COMPAC-PROD-001",
  "descricao": "Produção CPU-DREN-REATERRO-COMPAC",
  "origem": "PROPRIA",
  "valor_horario": 12.0,
  "composicao_padrao_equipe": {
    "funcoes": [
      {
        "funcao_id": "P0001",
        "num_pessoas": 4
      },
      {
        "funcao_id": "P0032",
        "num_pessoas": 1
      },
      {
        "funcao_id": "P0045",
        "num_pessoas": 1
      },
      {
        "funcao_id": "P0046",
        "num_pessoas": 1
      }
    ],
    "equipamentos": [
      {
        "equip_id": "EQ-E0030",
        "num_unidades": 2
      },
      {
        "equip_id": "EQ-E0002",
        "num_unidades": 1
      },
      {
        "equip_id": "EQ-E0024",
        "num_unidades": 1
      },
      {
        "equip_id": "EQ-E0029",
        "num_unidades": 1
      }
    ]
  },
  "historico_observacoes": []
}
