{
  "id": "CPU-TERRA-ATI-034-PROD-001",
  "codigo": "CPU-TERRA-ATI-034-PROD-001",
  "descricao": "Produção CPU-TERRA-ATI-034",
  "origem": "PROPRIA",
  "valor_horario": 0.25,
  "composicao_padrao_equipe": {
    "funcoes": [
      {
        "funcao_id": "MO-ENCARREG-DREN",
        "num_pessoas": 1
      },
      {
        "funcao_id": "MO-MONTADOR",
        "num_pessoas": 4
      },
      {
        "funcao_id": "MO-AJUDANTE",
        "num_pessoas": 4
      }
    ],
    "equipamentos": [
      {
        "equip_id": "EQ-E0027",
        "num_unidades": 1
      },
      {
        "equip_id": "EQ-E0026",
        "num_unidades": 1
      },
      {
        "equip_id": "EQ-E0002",
        "num_unidades": 1
      }
    ]
  },
  "historico_observacoes": []
}
