{
  "id": "CPU-TERRA-ATI-071-PROD-001",
  "codigo": "ATI-071",
  "descricao": "Assentamento piso intertravado (terceirizado)",
  "valor_horario": 25.0,
  "unidade": "m²",
  "origem": {
    "tipo": "planilha_rfi_r02",
    "fonte_id": "ATI-071",
    "data_calibracao": "2026-05-08",
    "referencia": "Planilha Padrão RFI R02 — MendesLôbo Construção"
  },
  "composicao_padrao_equipe": {
    "funcoes": [
      {
        "funcao_id": "P0065",
        "num_pessoas": 1
      },
      {
        "funcao_id": "P0037",
        "num_pessoas": 4
      },
      {
        "funcao_id": "P0001",
        "num_pessoas": 4
      }
    ],
    "equipamentos": []
  },
  "categoria": "TERRAPLENAGEM"
}