{
  "id": "CPU-TERRA-ATI-017-PROD-001",
  "codigo": "CPU-TERRA-ATI-017-PROD-001",
  "descricao": "Produção CPU-TERRA-ATI-017",
  "origem": "PROPRIA",
  "valor_horario": 162.12,
  "composicao_padrao_equipe": {
    "funcoes": [
      {
        "funcao_id": "MO-OPER-MOTO",
        "num_pessoas": 1
      },
      {
        "funcao_id": "MO-OPER-ROLO-COMP",
        "num_pessoas": 1
      },
      {
        "funcao_id": "MO-MOTOR-CAM-PIPA",
        "num_pessoas": 1
      },
      {
        "funcao_id": "MO-OPER-ROLO-COMP",
        "num_pessoas": 1
      },
      {
        "funcao_id": "MO-ENCARREG-TERRA",
        "num_pessoas": 1
      }
    ],
    "equipamentos": [
      {
        "equip_id": "EQ-E0029",
        "num_unidades": 1
      },
      {
        "equip_id": "EQ-E0035",
        "num_unidades": 1
      },
      {
        "equip_id": "EQ-E0010",
        "num_unidades": 1
      }
    ]
  },
  "atributos_categoria": {
    "custo_padrao_clt": 3.9201,
    "custo_padrao_pj": 3.3312
  },
  "cpu_ids": [
    "CPU-TERRA-ATI-017"
  ]
}