{
  "id": "CPU-TERRA-ATI-027-PROD-001",
  "codigo": "ATI-027",
  "descricao": "Corpo BSTC D=1,20m PA2 — Padrão VALEC",
  "valor_horario": 0.75,
  "unidade": "m",
  "origem": {
    "tipo": "planilha_rfi_r02",
    "fonte_id": "ATI-027",
    "data_calibracao": "2026-05-08",
    "referencia": "Planilha Padrão RFI R02 — MendesLôbo Construção"
  },
  "composicao_padrao_equipe": {
    "funcoes": [
      {
        "funcao_id": "P0020",
        "num_pessoas": 1
      },
      {
        "funcao_id": "P0037",
        "num_pessoas": 2
      },
      {
        "funcao_id": "P0001",
        "num_pessoas": 2
      }
    ],
    "equipamentos": [
      {
        "equip_id": "E0027",
        "num_unidades": 1
      },
      {
        "equip_id": "E0026",
        "num_unidades": 1
      }
    ]
  },
  "categoria": "TERRAPLENAGEM"
}